<?xml version="1.0" encoding="UTF-8"?>
<xs:schema xmlns:xs="http://www.w3.org/2001/XMLSchema">
    <xs:element name="libro">
        <xs:complexType>
            <xs:sequence>
                <xs:element name="libro">
                    <xs:complexType>
                        <xs:sequence>
                            <xs:element name="titulo" type="xs:string" />
                            <xs:element name="autor" type="xs:string" />
                            <xs:element name="nacionalidad">
                                <xs:complexType>
                                    <xs:sequence>
                                        <xs:element name="nacional" />
                                    </xs:sequence>
                                </xs:complexType>
                            </xs:element>
                            <xs:element name="libro">
                                <xs:complexType>
                                    <xs:sequence>
                                        <xs:element name="titulo">
                                            <xs:complexType>
                                                <xs:simpleContent>
                                                    <xs:extension base="xs:string">
                                                        <xs:attribute name="isbn" use="required" />
                                                    </xs:extension>
                                                </xs:simpleContent>
                                            </xs:complexType>
                                        </xs:element>
                                        <xs:element name="autor" type="xs:string" />
                                        <xs:element name="nacionalidad">
                                            <xs:complexType>
                                                <xs:sequence>
                                                    <xs:element name="extranjero" />
                                                </xs:sequence>
                                            </xs:complexType>
                                        </xs:element>
                                    </xs:sequence>
                                </xs:complexType>
                            </xs:element>
                        </xs:sequence>
                    </xs:complexType>
                </xs:element>
            </xs:sequence>
        </xs:complexType>
    </xs:element>
</xs:schema>